{
  "archetype": "make",
  "sector": "mfg",
  "company": "无锡恒驰汽车零部件有限公司",
  "co": "恒驰",
  "today": "2026-09-17",
  "weekStart": "2026-09-14",
  "overtimeMonth": "2026-08",
  "profile": {
    "industry": "mfg-auto",
    "size": "101_300",
    "province": "江苏",
    "city": "无锡",
    "founded": 2012,
    "revenue12": 50830000,
    "product": "汽车传动件与冲压件",
    "lines": "八条产线：下料、冲压 A / B、CNC 车铣、热处理、电镀、装配包装",
    "customers": "汽配、家电、储能设备",
    "region": "华南",
    "hotAllowancePaid": true,
    "hotJobsDepts": [
      "prod",
      "maint"
    ],
    "wageIndex": 0.9
  },
  "sources": [
    {
      "id": "hr",
      "name": "人事系统 · 花名册与合同",
      "mode": "direct",
      "lastSync": "2026-09-17 07:30",
      "rows": 168
    },
    {
      "id": "payroll",
      "name": "工资表 · 8 月",
      "mode": "import",
      "lastSync": "2026-09-10 18:00",
      "rows": 168
    },
    {
      "id": "attendance",
      "name": "考勤 · 8 月工时与加班",
      "mode": "import",
      "lastSync": "2026-09-05 18:00",
      "rows": 168
    },
    {
      "id": "recruit",
      "name": "招聘渠道导入 · 简历",
      "mode": "import",
      "lastSync": "2026-09-16 18:00",
      "rows": 30
    },
    {
      "id": "social",
      "name": "社保公积金申报表",
      "mode": "import",
      "lastSync": "2026-09-08 18:00",
      "rows": 168
    }
  ],
  "departments": [
    {
      "id": "prod",
      "name": "生产部",
      "budget": 94
    },
    {
      "id": "qc",
      "name": "品质部",
      "budget": 12
    },
    {
      "id": "tech",
      "name": "技术工艺部",
      "budget": 20
    },
    {
      "id": "maint",
      "name": "设备部",
      "budget": 6
    },
    {
      "id": "wh",
      "name": "仓储物流",
      "budget": 8
    },
    {
      "id": "buy",
      "name": "采购部",
      "budget": 5
    },
    {
      "id": "sales",
      "name": "销售部",
      "budget": 18
    },
    {
      "id": "cs",
      "name": "客服跟单",
      "budget": 4
    },
    {
      "id": "fin",
      "name": "财务部",
      "budget": 4
    },
    {
      "id": "hr",
      "name": "行政人事",
      "budget": 4
    }
  ],
  "employees": [
    {
      "id": "E-001",
      "dept": "prod",
      "job": "leader",
      "family": "ops",
      "hireDate": "2025-01-21",
      "gender": "M",
      "birthYear": 1987,
      "edu": "college",
      "wage": 7600,
      "contract": {
        "type": "fixed",
        "years": 3,
        "start": "2025-01-21",
        "end": "2028-01-21",
        "probationMonths": 2,
        "signed": true,
        "noncompete": false,
        "noncompeteComp": false
      },
      "socialBase": 4920,
      "injuryInsured": true,
      "overtimeH": 18,
      "annualDue": 5,
      "annualUsed": 0,
      "status": "active",
      "dispatch": false,
      "disabled": false,
      "leaveEnd": null
    },
    {
      "id": "E-002",
      "dept": "prod",
      "job": "leader",
      "family": "ops",
      "hireDate": "2026-01-26",
      "gender": "M",
      "birthYear": 1994,
      "edu": "college",
      "wage": 7170,
      "contract": {
        "type": "fixed",
        "years": 3,
        "start": "2026-01-26",
        "end": "2029-01-26",
        "probationMonths": 2,
        "signed": true,
        "noncompete": false,
        "noncompeteComp": false
      },
      "socialBase": 4580,
      "injuryInsured": true,
      "overtimeH": 24,
      "annualDue": 0,
      "annualUsed": 0,
      "status": "active",
      "dispatch": false,
      "disabled": false,
      "leaveEnd": null
    },
    {
      "id": "E-003",
      "dept": "prod",
      "job": "leader",
      "family": "ops",
      "hireDate": "2026-06-29",
      "gender": "F",
      "birthYear": 1987,
      "edu": "secondary",
      "wage": 7520,
      "contract": {
        "type": "fixed",
        "years": 1,
        "start": "2026-06-29",
        "end": "2027-06-29",
        "probationMonths": 1,
        "signed": true,
        "noncompete": false,
        "noncompeteComp": false
      },
      "socialBase": 4670,
      "injuryInsured": true,
      "overtimeH": 18,
      "annualDue": 0,
      "annualUsed": 0,
      "status": "active",
      "dispatch": false,
      "disabled": false,
      "leaveEnd": null
    },
    {
      "id": "E-004",
      "dept": "prod",
      "job": "leader",
      "family": "ops",
      "hireDate": "2025-02-06",
      "gender": "F",
      "birthYear": 2001,
      "edu": "secondary",
      "wage": 7790,
      "contract": {
        "type": "fixed",
        "years": 3,
        "start": "2025-02-06",
        "end": "2028-02-06",
        "probationMonths": 2,
        "signed": true,
        "noncompete": false,
        "noncompeteComp": false
      },
      "socialBase": 4690,
      "injuryInsured": true,
      "overtimeH": 19,
      "annualDue": 5,
      "annualUsed": 2,
      "status": "active",
      "dispatch": false,
      "disabled": false,
      "leaveEnd": null
    },
    {
      "id": "E-005",
      "dept": "prod",
      "job": "leader",
      "family": "ops",
      "hireDate": "2022-06-22",
      "gender": "M",
      "birthYear": 1999,
      "edu": "college",
      "wage": 8060,
      "contract": {
        "type": "fixed",
        "years": 3,
        "start": "2025-06-22",
        "end": "2028-06-22",
        "probationMonths": 2,
        "signed": true,
        "noncompete": false,
        "noncompeteComp": false
      },
      "socialBase": 4790,
      "injuryInsured": true,
      "overtimeH": 16,
      "annualDue": 5,
      "annualUsed": 3,
      "status": "active",
      "dispatch": false,
      "disabled": false,
      "leaveEnd": null
    },
    {
      "id": "E-006",
      "dept": "prod",
      "job": "leader",
      "family": "ops",
      "hireDate": "2018-06-28",
      "gender": "M",
      "birthYear": 1977,
      "edu": "college",
      "wage": 8420,
      "contract": {
        "type": "fixed",
        "years": 1,
        "start": "2026-06-28",
        "end": "2027-06-28",
        "probationMonths": 1,
        "signed": true,
        "noncompete": false,
        "noncompeteComp": false
      },
      "socialBase": 4620,
      "injuryInsured": true,
      "overtimeH": 25,
      "annualDue": 5,
      "annualUsed": 1,
      "status": "active",
      "dispatch": false,
      "disabled": false,
      "leaveEnd": null
    },
    {
      "id": "E-007",
      "dept": "prod",
      "job": "leader",
      "family": "ops",
      "hireDate": "2024-02-03",
      "gender": "F",
      "birthYear": 1993,
      "edu": "secondary",
      "wage": 7790,
      "contract": {
        "type": "fixed",
        "years": 3,
        "start": "2024-02-03",
        "end": "2027-02-03",
        "probationMonths": 2,
        "signed": true,
        "noncompete": false,
        "noncompeteComp": false
      },
      "socialBase": 4680,
      "injuryInsured": true,
      "overtimeH": 16,
      "annualDue": 5,
      "annualUsed": 0,
      "status": "active",
      "dispatch": false,
      "disabled": false,
      "leaveEnd": null
    },
    {
      "id": "E-008",
      "dept": "prod",
      "job": "leader",
      "family": "ops",
      "hireDate": "2013-04-15",
      "gender": "M",
      "birthYear": 1984,
      "edu": "college",
      "wage": 8510,
      "contract": {
        "type": "fixed",
        "years": 3,
        "start": "2025-04-15",
        "end": "2028-04-15",
        "probationMonths": 2,
        "signed": true,
        "noncompete": false,
        "noncompeteComp": false
      },
      "socialBase": 5030,
      "injuryInsured": true,
      "overtimeH": 32,
      "annualDue": 10,
      "annualUsed": 0,
      "status": "active",
      "dispatch": false,
      "disabled": false,
      "leaveEnd": null
    },
    {
      "id": "E-009",
      "dept": "prod",
      "job": "cut-op",
      "family": "ops",
      "hireDate": "2015-09-16",
      "gender": "M",
      "birthYear": 1993,
      "edu": "college",
      "wage": 6270,
      "contract": {
        "type": "fixed",
        "years": 3,
        "start": "2024-09-16",
        "end": "2027-09-16",
        "probationMonths": 2,
        "signed": true,
        "noncompete": false,
        "noncompeteComp": false
      },
      "socialBase": 4550,
      "injuryInsured": true,
      "overtimeH": 31,
      "annualDue": 10,
      "annualUsed": 6,
      "status": "active",
      "dispatch": false,
      "disabled": false,
      "leaveEnd": null
    },
    {
      "id": "E-010",
      "dept": "prod",
      "job": "cut-op",
      "family": "ops",
      "hireDate": "2023-08-01",
      "gender": "M",
      "birthYear": 2001,
      "edu": "secondary",
      "wage": 5910,
      "contract": {
        "type": "fixed",
        "years": 3,
        "start": "2026-08-01",
        "end": "2029-08-01",
        "probationMonths": 2,
        "signed": true,
        "noncompete": false,
        "noncompeteComp": false
      },
      "socialBase": 4580,
      "injuryInsured": true,
      "overtimeH": 30,
      "annualDue": 5,
      "annualUsed": 3,
      "status": "active",
      "dispatch": false,
      "disabled": false,
      "leaveEnd": null
    },
    {
      "id": "E-011",
      "dept": "prod",
      "job": "cut-op",
      "family": "ops",
      "hireDate": "2023-02-16",
      "gender": "F",
      "birthYear": 1995,
      "edu": "secondary",
      "wage": 5730,
      "contract": {
        "type": "fixed",
        "years": 1,
        "start": "2026-02-16",
        "end": "2027-02-16",
        "probationMonths": 1,
        "signed": true,
        "noncompete": false,
        "noncompeteComp": false
      },
      "socialBase": 4620,
      "injuryInsured": true,
      "overtimeH": 28,
      "annualDue": 5,
      "annualUsed": 3,
      "status": "active",
      "dispatch": false,
      "disabled": false,
      "leaveEnd": null
    },
    {
      "id": "E-012",
      "dept": "prod",
      "job": "cut-op",
      "family": "ops",
      "hireDate": "2026-01-21",
      "gender": "M",
      "birthYear": 1990,
      "edu": "secondary",
      "wage": 5020,
      "contract": {
        "type": "fixed",